{
    "$schema": "http://json-schema.org/draft-07/schema#",
    "$id": "urn:plasmazones:schema:shader-metadata",
    "title": "PlasmaZones Wallpaper Shader Metadata",
    "description": "metadata.json for a bundled or user wallpaper-shader pack. Core identity and the parameter contract are enforced. Optional multipass, buffer (including halfFloatBuffers), and wallpaper rendering keys, plus descriptive metadata (category, description, author, version), are type-checked so a wrong-typed value is rejected at the gate rather than silently swallowed by a typed accessor at load.",
    "type": "object",
    "required": ["id", "name", "fragmentShader"],
    "properties": {
        "id": { "type": "string", "minLength": 1 },
        "name": { "type": "string", "minLength": 1 },
        "category": { "type": "string" },
        "description": { "type": "string" },
        "author": { "type": "string" },
        "version": { "type": "string" },
        "fragmentShader": { "type": "string", "minLength": 1 },
        "vertexShader": { "type": "string" },
        "parameters": {
            "type": "array",
            "maxItems": 48,
            "items": { "$ref": "#/definitions/parameter" }
        },
        "presets": {
            "type": "object",
            "maxProperties": 64,
            "description": "Named parameter presets. Each value is a map of parameter id to value. A preset id is its key here, and it is also the label the picker shows, so it has to read as a name. That rules out control and bidi-formatting characters, and anything longer than a label can show. Unlike a user preset id it never becomes a filename, because duplicating a pack preset mints a fresh UUID. A null value is allowed and means the preset says nothing about that parameter, so it keeps the pack's default; the loader drops the entry. Those rules are checked by plasmazones-shader-validate rather than here, because the vendored JSON-schema validator rejects every name under a propertyNames rule, legitimate ones included. Image-typed values are pack-declared paths and are containment-checked at load like an image param's default.",
            "additionalProperties": {
                "type": "object",
                "maxProperties": 48,
                "additionalProperties": { "type": ["number", "string", "boolean", "null"] }
            }
        },
        "multipass": { "type": "boolean" },
        "bufferShader": { "type": "string" },
        "bufferShaders": { "type": "array", "items": { "type": "string" } },
        "bufferScale": {
            "type": "number",
            "minimum": 0.0078125,
            "maximum": 1.0,
            "description": "Render scale for the WHOLE buffer chain. The overlay family has no per-pass bufferScales list, because that one is surface-only. Bounds track PhosphorShaders::kMinBufferScale and kMaxBufferScale."
        },
        "bufferWrap": { "type": "string" },
        "bufferWraps": { "type": "array", "items": { "type": "string" } },
        "bufferFilter": { "type": "string" },
        "bufferFilters": { "type": "array", "items": { "type": "string" } },
        "bufferFeedback": { "type": "boolean" },
        "depthBuffer": { "type": "boolean" },
        "halfFloatBuffers": { "type": "boolean" },
        "wallpaper": { "type": "boolean" }
    },
    "definitions": {
        "parameter": {
            "type": "object",
            "required": ["id", "name", "type", "default"],
            "properties": {
                "id": { "type": "string", "minLength": 1 },
                "name": { "type": "string", "minLength": 1 },
                "group": { "type": "string" },
                "type": {
                    "type": "string",
                    "enum": ["float", "int", "bool", "color", "image"],
                    "description": "Marshalling type of the uniform (image binds a texture slot). An unknown type cannot be bound, so it is rejected."
                },
                "default": {
                    "type": ["number", "string", "boolean", "null"],
                    "description": "Default value. Use a string for color (#rrggbb), a number for float or int, and a boolean for bool."
                },
                "min": { "type": "number" },
                "max": { "type": "number" },
                "slot": {
                    "type": "integer",
                    "minimum": 0,
                    "maximum": 31,
                    "description": "Explicit UBO lane. 31 is the scalar-pool ceiling, and the color pool tops out at 15 with the image pool at 3, which the pack validator lints per type."
                },
                "unit": {
                    "type": "string",
                    "enum": ["px"],
                    "description": "Unit the value is expressed in. Omit for a plain number. \"px\" declares logical pixels of the real surface the shader draws on, which a host rendering at reduced size (a settings preview) scales down by that reduction so the effect reads as a faithful miniature rather than one several times too coarse."
                },
                "use_zone_color": {
                    "type": "boolean",
                    "description": "Take the value from the zone's own colour rather than the declared default, so the pack follows the user's zone palette. Read by the pack parser and re-exported to the settings UI."
                },
                "wrap": {
                    "type": "string",
                    "description": "Sampler wrap mode for an image parameter: clamp, repeat or mirror, matching the runtime normaliser in ShaderNodeRhi. Omit to take the default clamp. The vocabulary is deliberately not pinned to an enum here, because the loader already warns about an unrecognised token and drops it so the sampler keeps its default. Rejecting the whole pack at this gate would turn a one-word typo into a pack that does not load at all."
                }
            },
            "additionalProperties": false
        }
    }
}
