{
    "id": "prismata",
    "name": "Prismata",
    "category": "Energy",
    "description": "A crystalline prismatic overlay where facets and caustics flow across zones. It reacts to sound, and highlighted zones get chromatic fracture and inner resonance",
    "author": "PlasmaZones",
    "version": "1.0",
    "fragmentShader": "effect.frag",
    "multipass": false,
    "parameters": [
        {
            "id": "cellScale",
            "name": "Cell Scale",
            "group": "Crystalline",
            "type": "int",
            "default": 12,
            "min": 4,
            "max": 32
        },
        {
            "id": "animSpeed",
            "name": "Animation Speed",
            "group": "Crystalline",
            "type": "float",
            "default": 0.6,
            "min": 0,
            "max": 2
        },
        {
            "id": "facetSharpness",
            "name": "Facet Sharpness",
            "group": "Crystalline",
            "type": "float",
            "default": 0.7,
            "min": 0.1,
            "max": 1
        },
        {
            "id": "zoneTintBlend",
            "name": "Zone Tint Blend",
            "group": "Crystalline",
            "type": "float",
            "default": 0.35,
            "min": 0,
            "max": 1
        },
        {
            "id": "fillOpacity",
            "name": "Fill Opacity",
            "group": "Appearance",
            "type": "float",
            "default": 0.88,
            "min": 0.5,
            "max": 1
        },
        {
            "id": "causticStrength",
            "name": "Caustic Strength",
            "group": "Highlight",
            "type": "float",
            "default": 0.5,
            "min": 0,
            "max": 1
        },
        {
            "id": "chromaticStrength",
            "name": "Chromatic Dispersion",
            "group": "Highlight",
            "type": "float",
            "default": 0.4,
            "min": 0,
            "max": 1
        },
        {
            "id": "resonanceStrength",
            "name": "Inner Resonance",
            "group": "Highlight",
            "type": "float",
            "default": 0.6,
            "min": 0,
            "max": 1
        },
        {
            "id": "audioReactivity",
            "name": "Audio Reactivity",
            "group": "Audio",
            "type": "float",
            "default": 1.0,
            "min": 0,
            "max": 2
        },
        {
            "id": "idlePulse",
            "name": "Idle Pulse",
            "group": "Audio",
            "type": "float",
            "default": 0.8,
            "min": 0,
            "max": 1.5
        },
        {
            "id": "accentColor",
            "name": "Accent / Glow",
            "group": "Colors",
            "type": "color",
            "default": "#00d4ff"
        },
        {
            "id": "highlightTint",
            "name": "Highlight Tint",
            "group": "Colors",
            "type": "color",
            "default": "#ffffff"
        },
        {
            "id": "crystalColor1",
            "name": "Crystal Color 1",
            "group": "Crystal Palette",
            "type": "color",
            "default": "#334466"
        },
        {
            "id": "crystalColor2",
            "name": "Crystal Color 2",
            "group": "Crystal Palette",
            "type": "color",
            "default": "#4488cc"
        },
        {
            "id": "crystalColor3",
            "name": "Crystal Color 3",
            "group": "Crystal Palette",
            "type": "color",
            "default": "#88aadd"
        },
        {
            "id": "crystalColor4",
            "name": "Crystal Color 4",
            "group": "Crystal Palette",
            "type": "color",
            "default": "#aaccff"
        },
        {
            "id": "edgeColor",
            "name": "Facet Edge Color",
            "group": "Crystal Palette",
            "type": "color",
            "default": "#00d4ff"
        },
        {
            "id": "etchSpread",
            "name": "Crystal Etch Spread",
            "group": "Labels",
            "type": "float",
            "default": 3.0,
            "min": 1.0,
            "max": 6.0
        },
        {
            "id": "etchBright",
            "name": "Etch Brightness",
            "group": "Labels",
            "type": "float",
            "default": 2.0,
            "min": 0.5,
            "max": 4.0
        },
        {
            "id": "refractionReact",
            "name": "Refraction Reactivity",
            "group": "Labels",
            "type": "float",
            "default": 1.0,
            "min": 0.0,
            "max": 2.0
        },
        {
            "id": "showLabels",
            "name": "Show Labels",
            "group": "Labels",
            "type": "bool",
            "default": true
        }
    ]
}
