{
    "id": "pulse-flow",
    "name": "Pulse Flow",
    "category": "Energy",
    "description": "Lightweight energy aura: zone borders emit flowing energy that spirals inward through ping-pong feedback, building smooth radiant halos; bass drives emission surges and radial pulses, mids shift the spiral topology and cycle colors, treble injects spark traces; designed for full-screen performance",
    "author": "PlasmaZones",
    "version": "1.0",
    "multipass": true,
    "bufferShaders": [
        "pass0.frag"
    ],
    "bufferFeedback": true,
    "bufferWrap": "clamp",
    "fragmentShader": "effect.frag",
    "parameters": [
        {
            "id": "intensity",
            "name": "Energy Intensity",
            "group": "Energy",
            "type": "float",
            "slot": 0,
            "default": 0.9,
            "min": 0.1,
            "max": 1.5
        },
        {
            "id": "trailPersistence",
            "name": "Trail Persistence",
            "group": "Energy",
            "type": "float",
            "slot": 1,
            "default": 0.955,
            "min": 0.9,
            "max": 0.995
        },
        {
            "id": "edgeWidth",
            "name": "Edge Emission Width",
            "group": "Energy",
            "type": "float",
            "slot": 2,
            "default": 14.0,
            "min": 3.0,
            "max": 40.0
        },
        {
            "id": "feedbackStrength",
            "name": "Feedback Strength",
            "group": "Feedback",
            "type": "float",
            "slot": 3,
            "default": 0.5,
            "min": 0.0,
            "max": 1.0
        },
        {
            "id": "driftSpeed",
            "name": "Flow Speed",
            "group": "Flow",
            "type": "float",
            "slot": 4,
            "default": 0.35,
            "min": 0.0,
            "max": 1.2
        },
        {
            "id": "rotationSpeed",
            "name": "Spiral Speed",
            "group": "Flow",
            "type": "float",
            "slot": 5,
            "default": 0.03,
            "min": 0.0,
            "max": 0.15
        },
        {
            "id": "audioReactivity",
            "name": "Audio Reactivity",
            "group": "Audio",
            "type": "float",
            "slot": 6,
            "default": 1.0,
            "min": 0.0,
            "max": 2.0
        },
        {
            "id": "showLabels",
            "name": "Show Labels",
            "group": "Labels",
            "type": "bool",
            "slot": 7,
            "default": true
        },
        {
            "id": "fillOpacity",
            "name": "Zone Fill Opacity",
            "group": "Composite",
            "type": "float",
            "slot": 8,
            "default": 0.85,
            "min": 0.3,
            "max": 1.0
        },
        {
            "id": "zoneTint",
            "name": "Zone Color Tint",
            "group": "Composite",
            "type": "float",
            "slot": 9,
            "default": 0.15,
            "min": 0.0,
            "max": 1.0
        },
        {
            "id": "glowRadius",
            "name": "Outer Glow Size",
            "group": "Composite",
            "type": "float",
            "slot": 10,
            "default": 8.0,
            "min": 2.0,
            "max": 20.0
        },
        {
            "id": "labelGlowSpread",
            "name": "Label Glow Spread",
            "group": "Labels",
            "type": "float",
            "slot": 12,
            "default": 3.5,
            "min": 1.0,
            "max": 8.0
        },
        {
            "id": "labelBrightness",
            "name": "Label Brightness",
            "group": "Labels",
            "type": "float",
            "slot": 13,
            "default": 1.5,
            "min": 0.5,
            "max": 3.0
        },
        {
            "id": "labelAudioReact",
            "name": "Label Audio Reactivity",
            "group": "Labels",
            "type": "float",
            "slot": 14,
            "default": 1.0,
            "min": 0.0,
            "max": 2.0
        },
        {
            "id": "labelChromaStr",
            "name": "Label Chromatic Aberration",
            "group": "Labels",
            "type": "float",
            "slot": 15,
            "default": 1.5,
            "min": 0.0,
            "max": 4.0
        },
        {
            "id": "glowColor",
            "name": "Active Glow Color",
            "group": "Colors",
            "type": "color",
            "slot": 0,
            "default": "#ff9933"
        },
        {
            "id": "trailColor",
            "name": "Trail Color",
            "group": "Colors",
            "type": "color",
            "slot": 1,
            "default": "#6633cc"
        }
    ]
}
